<?xml version="1.0" encoding="UTF-8"?>
<dataroot xmlns:od="urn:schemas-microsoft-com:officedata" xmlns:xsi="http://www.w3.org/2001/XMLSchema-instance"  xsi:noNamespaceSchemaLocation="Inhalte.xsd" generated="2023-05-21T18:34:36">
<Inhalte>
<Werk>3</Werk>
<ID>2</ID>
<Titel>Liebet eure Aeltern - Sie haben euch geliebt!</Titel>
<Sortiertitel>Liebet eure Aeltern - Sie haben euch geliebt!</Sortiertitel>
<Anmerkungen>&lt;div&gt;Graphik im Kalendarium paginiert 3. s. Textbezug INr 32075, Obj 13&lt;/div&gt;</Anmerkungen>
<Typ>
<Value>Gedicht/Lied</Value>
</Typ>
<Typ>
<Value>Graphik</Value>
</Typ>
<Digitalisat>1</Digitalisat>
<Objektnummer>1</Objektnummer>
<DEPR_INHNR>32068</DEPR_INHNR>
</Inhalte>
</dataroot>
